"";"query";"significant";"p_value";"term_size";"query_size";"intersection_size";"precision";"recall";"term_id";"source";"term_name";"effective_domain_size";"source_order";"set"
"1";"query_1";TRUE;0,0300587703129495;4627;78;34;0,435897435897436;0,00734817376269721;"GO:0007275";"GO:BP";"multicellular organism development";21128;2887;"Bladder_female_10_community"
"2";"query_1";TRUE;0,0482147453152581;155;70;6;0,0857142857142857;0,0387096774193548;"MIRNA:hsa-miR-431-5p";"MIRNA";"hsa-miR-431-5p";14850;1004;"Bladder_female_10_community"
"3";"query_1";TRUE;3,78988907015411e-05;10522;87;71;0,816091954022989;0,00674776658429956;"TF:M01104";"TF";"Factor: MOVO-B; motif: GNGGGGG";20012;5238;"Bladder_female_10_community"
"4";"query_1";TRUE;0,000280574809883216;10654;87;70;0,804597701149425;0,00657030223390276;"TF:M00986_1";"TF";"Factor: Churchill; motif: CGGGNN; match class: 1";20012;835;"Bladder_female_10_community"
"5";"query_1";TRUE;0,000357926241888563;12713;87;77;0,885057471264368;0,00605679225989145;"TF:M00333_1";"TF";"Factor: ZF5; motif: NRNGNGCGCGCWN; match class: 1";20012;9235;"Bladder_female_10_community"
"6";"query_1";TRUE;0,000408648505209262;11002;87;71;0,816091954022989;0,00645337211416106;"TF:M07250";"TF";"Factor: E2F-1; motif: NNNSSCGCSAANN";20012;1452;"Bladder_female_10_community"
"7";"query_1";TRUE;0,000631504054319332;9538;87;65;0,747126436781609;0,00681484587963934;"TF:M10426";"TF";"Factor: ctcf; motif: CCRSCAGGGGGCGCN";20012;1150;"Bladder_female_10_community"
"8";"query_1";TRUE;0,000661880534319136;13482;87;79;0,908045977011494;0,00585966473816941;"TF:M11603_1";"TF";"Factor: TCF-1; motif: ACATCGRGRCGCTGW; match class: 1";20012;8411;"Bladder_female_10_community"
"9";"query_1";TRUE;0,00108258534716892;12643;87;76;0,873563218390805;0,00601123151150834;"TF:M11531_1";"TF";"Factor: E2F-2; motif: GCGCGCGCGYW; match class: 1";20012;1473;"Bladder_female_10_community"
"10";"query_1";TRUE;0,00112205529661271;13595;87;79;0,908045977011494;0,00581095991173225;"TF:M11531";"TF";"Factor: E2F-2; motif: GCGCGCGCGYW";20012;1472;"Bladder_female_10_community"
"11";"query_1";TRUE;0,00127343032462601;6304;87;50;0,574712643678161;0,00793147208121827;"TF:M01973";"TF";"Factor: PLAG1; motif: CCCCCKWNNNGGSCCC";20012;6638;"Bladder_female_10_community"
"12";"query_1";TRUE;0,00224171744843926;4465;87;40;0,459770114942529;0,00895856662933931;"TF:M12703_1";"TF";"Factor: ZNF383; motif: SSNGGGMGGNGSNGGS; match class: 1";20012;10111;"Bladder_female_10_community"
"13";"query_1";TRUE;0,00228577657311673;9321;87;63;0,724137931034483;0,00675893144512391;"TF:M00800";"TF";"Factor: AP-2; motif: GSCCSCRGGCNRNRNN";20012;150;"Bladder_female_10_community"
"14";"query_1";TRUE;0,00283669057012574;15212;87;83;0,954022988505747;0,00545621877465159;"TF:M10438_1";"TF";"Factor: ZF5; motif: GGSGCGCGS; match class: 1";20012;9227;"Bladder_female_10_community"
"15";"query_1";TRUE;0,00324892886534598;7116;87;53;0,609195402298851;0,00744800449690838;"TF:M12598_1";"TF";"Factor: E2F3; motif: NNRGMKGGAR; match class: 1";20012;1495;"Bladder_female_10_community"
"16";"query_1";TRUE;0,00417218125118597;5326;87;44;0,505747126436782;0,00826135936913256;"TF:M00933_1";"TF";"Factor: Sp1; motif: CCCCGCCCCN; match class: 1";20012;7847;"Bladder_female_10_community"
"17";"query_1";TRUE;0,0058810296810505;12723;87;75;0,862068965517241;0,00589483612355577;"TF:M12598";"TF";"Factor: E2F3; motif: NNRGMKGGAR";20012;1494;"Bladder_female_10_community"
"18";"query_1";TRUE;0,00620939080722857;3912;87;36;0,413793103448276;0,00920245398773006;"TF:M03811_1";"TF";"Factor: AP-2gamma; motif: GCCYNCRGSN; match class: 1";20012;145;"Bladder_female_10_community"
"19";"query_1";TRUE;0,0079089096176412;4494;87;39;0,448275862068966;0,00867823765020027;"TF:M10432_1";"TF";"Factor: MAZ; motif: GGGMGGGGS; match class: 1";20012;4997;"Bladder_female_10_community"
"20";"query_1";TRUE;0,00844963506943626;11135;87;69;0,793103448275862;0,0061966771441401;"TF:M07206_1";"TF";"Factor: E2F-1; motif: NGGGCGGGARV; match class: 1";20012;1439;"Bladder_female_10_community"
"21";"query_1";TRUE;0,00889108091157776;7325;87;53;0,609195402298851;0,00723549488054607;"TF:M07397";"TF";"Factor: ZBP89; motif: CCCCKCCCCCNN";20012;9072;"Bladder_female_10_community"
"22";"query_1";TRUE;0,0102003439243219;6093;87;47;0,540229885057471;0,00771376989988511;"TF:M00196_1";"TF";"Factor: Sp1; motif: NGGGGGCGGGGYN; match class: 1";20012;7855;"Bladder_female_10_community"
"23";"query_1";TRUE;0,0102382743761366;8018;87;56;0,64367816091954;0,00698428535794462;"TF:M00982";"TF";"Factor: KROX; motif: CCCGCCCCCRCCCC";20012;4612;"Bladder_female_10_community"
"24";"query_1";TRUE;0,0103285269570953;6300;87;48;0,551724137931034;0,00761904761904762;"TF:M09723_1";"TF";"Factor: BTEB1; motif: GGGGGCGGGGCNGSGGGNGS; match class: 1";20012;613;"Bladder_female_10_community"
"25";"query_1";TRUE;0,0105827665380373;14426;87;80;0,919540229885057;0,00554554276999861;"TF:M09636_1";"TF";"Factor: MAZ; motif: GGGMGGGGSSGGGGGGGGGGGG; match class: 1";20012;4993;"Bladder_female_10_community"
"26";"query_1";TRUE;0,0112229352056958;4371;87;38;0,436781609195402;0,00869366277739648;"TF:M00800_1";"TF";"Factor: AP-2; motif: GSCCSCRGGCNRNRNN; match class: 1";20012;151;"Bladder_female_10_community"
"27";"query_1";TRUE;0,0117705317821672;4197;87;37;0,425287356321839;0,00881582082439838;"TF:M01073";"TF";"Factor: HIC1; motif: NNNGGKTGCCCSNNNNNN";20012;3404;"Bladder_female_10_community"
"28";"query_1";TRUE;0,0123803189987754;10195;87;65;0,747126436781609;0,00637567435017165;"TF:M09896";"TF";"Factor: E2F-7; motif: GRGGCGGGAANNN";20012;1530;"Bladder_female_10_community"
"29";"query_1";TRUE;0,0139875332138;9009;87;60;0,689655172413793;0,00666000666000666;"TF:M08487_1";"TF";"Factor: GCMa:Erg; motif: ATGCGGGCGGAARKG; match class: 1";20012;3043;"Bladder_female_10_community"
"30";"query_1";TRUE;0,0147089260721355;2856;87;29;0,333333333333333;0,0101540616246499;"TF:M01118_1";"TF";"Factor: WT1; motif: SMCNCCNSC; match class: 1";20012;8985;"Bladder_female_10_community"
"31";"query_1";TRUE;0,0153788716017916;14512;87;80;0,919540229885057;0,00551267916207277;"TF:M00986";"TF";"Factor: Churchill; motif: CGGGNN";20012;834;"Bladder_female_10_community"
"32";"query_1";TRUE;0,0157613803123243;10003;87;64;0,735632183908046;0,00639808057582725;"TF:M02036";"TF";"Factor: WT1; motif: CGCCCCCNCN";20012;8986;"Bladder_female_10_community"
"33";"query_1";TRUE;0,0171854326454145;7468;87;53;0,609195402298851;0,00709694697375469;"TF:M01175";"TF";"Factor: CKROX; motif: SCCCTCCCC";20012;852;"Bladder_female_10_community"
"34";"query_1";TRUE;0,0174482405543699;4449;87;38;0,436781609195402;0,00854124522364576;"TF:M01783_1";"TF";"Factor: SP2; motif: GGGCGGGAC; match class: 1";20012;7859;"Bladder_female_10_community"
"35";"query_1";TRUE;0,0184391841170029;9551;87;62;0,71264367816092;0,00649146686210868;"TF:M00649";"TF";"Factor: MAZ; motif: GGGGAGGG";20012;5002;"Bladder_female_10_community"
"36";"query_1";TRUE;0,0236523665699336;7982;87;55;0,632183908045977;0,00689050363317464;"TF:M09895";"TF";"Factor: E2F-6; motif: NGGGCGGGARRNN";20012;1524;"Bladder_female_10_community"
"37";"query_1";TRUE;0,0242312669036095;5270;87;42;0,482758620689655;0,0079696394686907;"TF:M03814";"TF";"Factor: BTEB2; motif: GNAGGGGGNGGGSSNN";20012;622;"Bladder_female_10_community"
"38";"query_1";TRUE;0,0243970411596223;6688;87;49;0,563218390804598;0,00732655502392345;"TF:M10108";"TF";"Factor: WT1; motif: RGGNGGGGGAGGRGGNGGRG";20012;8980;"Bladder_female_10_community"
"39";"query_1";TRUE;0,0284714113261448;8250;87;56;0,64367816091954;0,00678787878787879;"TF:M12160_1";"TF";"Factor: KLF15; motif: RCCMCRCCCMCN; match class: 1";20012;4551;"Bladder_female_10_community"
"40";"query_1";TRUE;0,028594283506722;8709;87;58;0,666666666666667;0,00665977724193363;"TF:M01199";"TF";"Factor: RNF96; motif: BCCCGCRGCC";20012;7290;"Bladder_female_10_community"
"41";"query_1";TRUE;0,0288369471949148;8711;87;58;0,666666666666667;0,00665824819194122;"TF:M10112";"TF";"Factor: Miz-1; motif: NNRGGWGGGGGAGGGGMRR";20012;5200;"Bladder_female_10_community"
"42";"query_1";TRUE;0,0324124351751254;4193;87;36;0,413793103448276;0,00858573813498688;"TF:M04953_1";"TF";"Factor: Sp1; motif: GGNDGGRGGCGGGG; match class: 1";20012;7831;"Bladder_female_10_community"
"43";"query_1";TRUE;0,0328606063967808;10683;87;66;0,758620689655172;0,0061780398764392;"TF:M00695";"TF";"Factor: ETF; motif: GVGGMGG";20012;2164;"Bladder_female_10_community"
"44";"query_1";TRUE;0,0350544757343892;10699;87;66;0,758620689655172;0,00616880082250678;"TF:M08205_1";"TF";"Factor: E2F-1:Elk-1; motif: SGCGCSNNAMCGGAAGT; match class: 1";20012;1429;"Bladder_female_10_community"
"45";"query_1";TRUE;0,0401271426194177;6379;87;47;0,540229885057471;0,00736792600721116;"TF:M08875";"TF";"Factor: E2F; motif: NNTTTCGCGCN";20012;1560;"Bladder_female_10_community"
"46";"query_1";TRUE;0,0410673967407412;5573;87;43;0,494252873563218;0,00771577247443029;"TF:M07084_1";"TF";"Factor: E2F-4; motif: NGGCGGGAARN; match class: 1";20012;1509;"Bladder_female_10_community"
"47";"query_1";TRUE;0,0412657160274158;9030;87;59;0,67816091954023;0,00653377630121816;"TF:M03811";"TF";"Factor: AP-2gamma; motif: GCCYNCRGSN";20012;144;"Bladder_female_10_community"
"48";"query_1";TRUE;0,0425514628771741;7895;87;54;0,620689655172414;0,00683977200759975;"TF:M03567";"TF";"Factor: Sp2; motif: NYSGCCCCGCCCCCY";20012;7878;"Bladder_female_10_community"
"49";"query_1";TRUE;0,0452317089597066;9527;87;61;0,701149425287356;0,00640285504356041;"TF:M10432";"TF";"Factor: MAZ; motif: GGGMGGGGS";20012;4996;"Bladder_female_10_community"
"50";"query_1";TRUE;0,045426261251211;3193;87;30;0,344827586206897;0,00939555277168807;"TF:M12697";"TF";"Factor: ZNF142; motif: SNSCGCCCGCCCGCSCSS";20012;9502;"Bladder_female_10_community"
"51";"query_1";TRUE;0,045896701354794;7040;87;50;0,574712643678161;0,00710227272727273;"TF:M12464";"TF";"Factor: ZNF148; motif: NNCCCCTCCCCC";20012;9508;"Bladder_female_10_community"
"52";"query_1";TRUE;0,0470844432546526;6414;87;47;0,540229885057471;0,00732772061116308;"TF:M10072_1";"TF";"Factor: sp4; motif: NNGNARGRGGCGGRGCNNRR; match class: 1";20012;7895;"Bladder_female_10_community"
"53";"query_1";TRUE;0,047622028638181;14451;87;79;0,908045977011494;0,00546674970590271;"TF:M00716_1";"TF";"Factor: ZF5; motif: GSGCGCGR; match class: 1";20012;9223;"Bladder_female_10_community"
