"";"query";"significant";"p_value";"term_size";"query_size";"intersection_size";"precision";"recall";"term_id";"source";"term_name";"effective_domain_size";"source_order";"set"
"1";"query_1";TRUE;5,83911724358736e-07;6;78;4;0,0512820512820513;0,666666666666667;"GO:0016602";"GO:CC";"CCAAT-binding factor complex";22112;770;"Brain_-_Cortex_female_7_community"
"2";"query_1";TRUE;0,0498855965701429;6;78;2;0,0256410256410256;0,333333333333333;"GO:0032133";"GO:CC";"chromosome passenger complex";22112;1257;"Brain_-_Cortex_female_7_community"
"3";"query_1";TRUE;0,0153705292691468;69;35;4;0,114285714285714;0,0579710144927536;"KEGG:04612";"KEGG";"Antigen processing and presentation";8091;316;"Brain_-_Cortex_female_7_community"
"4";"query_1";TRUE;0,00199142405089286;9;45;3;0,0666666666666667;0,333333333333333;"REAC:R-HSA-381183";"REAC";"ATF6 (ATF6-alpha) activates chaperone genes";10777;33;"Brain_-_Cortex_female_7_community"
"5";"query_1";TRUE;0,00388890384455181;11;45;3;0,0666666666666667;0,272727272727273;"REAC:R-HSA-381033";"REAC";"ATF6 (ATF6-alpha) activates chaperones";10777;34;"Brain_-_Cortex_female_7_community"
"6";"query_1";TRUE;0,00770284576534571;40;45;4;0,0888888888888889;0,1;"REAC:R-HSA-2426168";"REAC";"Activation of gene expression by SREBF (SREBP)";10777;97;"Brain_-_Cortex_female_7_community"
"7";"query_1";TRUE;0,0130071162686435;16;45;3;0,0666666666666667;0,1875;"REAC:R-HSA-9614657";"REAC";"FOXO-mediated transcription of cell death genes";10777;879;"Brain_-_Cortex_female_7_community"
"8";"query_1";TRUE;0,013081236676017;152;45;6;0,133333333333333;0,0394736842105263;"REAC:R-HSA-8957322";"REAC";"Metabolism of steroids";10777;1362;"Brain_-_Cortex_female_7_community"
"9";"query_1";TRUE;0,0237237261597501;53;45;4;0,0888888888888889;0,0754716981132075;"REAC:R-HSA-1655829";"REAC";"Regulation of cholesterol biosynthesis by SREBP (SREBF)";10777;1912;"Brain_-_Cortex_female_7_community"
"10";"query_1";TRUE;3,59443252814032e-30;2038;80;53;0,6625;0,0260058881256133;"TF:M12643";"TF";"Factor: NFYB; motif: RGCCAATSRGNRNNNNSNG";20012;5746;"Brain_-_Cortex_female_7_community"
"11";"query_1";TRUE;7,95697340219068e-30;2849;80;59;0,7375;0,0207090207090207;"TF:M12642";"TF";"Factor: NFYA; motif: NNRGCCAATSRGMRSSNNSN";20012;5738;"Brain_-_Cortex_female_7_community"
"12";"query_1";TRUE;8,72333463525091e-30;3152;80;61;0,7625;0,0193527918781726;"TF:M03862_1";"TF";"Factor: YB-1; motif: NNNNCCAATNN; match class: 1";20012;9011;"Brain_-_Cortex_female_7_community"
"13";"query_1";TRUE;2,87815601116476e-29;2915;80;59;0,7375;0,0202401372212693;"TF:M12616";"TF";"Factor: HMGXB3; motif: NRGCCAATSRGNRNNS";20012;3474;"Brain_-_Cortex_female_7_community"
"14";"query_1";TRUE;6,12137814112985e-27;1776;80;48;0,6;0,027027027027027;"TF:M02106";"TF";"Factor: NF-YA; motif: CRGCCAATCAGNRN";20012;5740;"Brain_-_Cortex_female_7_community"
"15";"query_1";TRUE;3,72468397360691e-26;2582;80;54;0,675;0,0209140201394268;"TF:M10006";"TF";"Factor: NF-YC; motif: NNRRCCAATCAGNR";20012;5748;"Brain_-_Cortex_female_7_community"
"16";"query_1";TRUE;1,25851442850903e-25;1681;80;46;0,575;0,0273646638905413;"TF:M00287";"TF";"Factor: NF-Y; motif: NNNRRCCAATSRGNNN";20012;5754;"Brain_-_Cortex_female_7_community"
"17";"query_1";TRUE;4,17978896131136e-25;1728;80;46;0,575;0,0266203703703704;"TF:M04683";"TF";"Factor: NF-YA; motif: YTCTSATTGGYYRN";20012;5730;"Brain_-_Cortex_female_7_community"
"18";"query_1";TRUE;6,10720099900351e-22;2293;80;48;0,6;0,0209332751853467;"TF:M10005";"TF";"Factor: NF-YA; motif: NYRRCCAATCAGAR";20012;5736;"Brain_-_Cortex_female_7_community"
"19";"query_1";TRUE;1,19538069461861e-21;1626;80;42;0,525;0,025830258302583;"TF:M07302";"TF";"Factor: NF-Y; motif: RGCCAATCRGN";20012;5758;"Brain_-_Cortex_female_7_community"
"20";"query_1";TRUE;3,85931715785561e-20;5953;80;67;0,8375;0,0112548294977322;"TF:M12668_1";"TF";"Factor: SP2; motif: NNRRCCAATSRGNRNSNGSN; match class: 1";20012;7877;"Brain_-_Cortex_female_7_community"
"21";"query_1";TRUE;5,14101740161931e-20;1469;80;39;0,4875;0,0265486725663717;"TF:M00775";"TF";"Factor: NF-Y; motif: NNNNRRCCAATSR";20012;5762;"Brain_-_Cortex_female_7_community"
"22";"query_1";TRUE;2,66273979877101e-19;1335;80;37;0,4625;0,0277153558052434;"TF:M12455";"TF";"Factor: NFYC; motif: NNCCAATCANN";20012;5750;"Brain_-_Cortex_female_7_community"
"23";"query_1";TRUE;4,73247252057839e-18;2013;80;42;0,525;0,0208643815201192;"TF:M09816";"TF";"Factor: NFYA; motif: RRCCAATCAGN";20012;5734;"Brain_-_Cortex_female_7_community"
"24";"query_1";TRUE;1,56627086191728e-17;9300;80;76;0,95;0,00817204301075269;"TF:M03862";"TF";"Factor: YB-1; motif: NNNNCCAATNN";20012;9010;"Brain_-_Cortex_female_7_community"
"25";"query_1";TRUE;1,8328837869498e-16;558;80;25;0,3125;0,0448028673835125;"TF:M12642_1";"TF";"Factor: NFYA; motif: NNRGCCAATSRGMRSSNNSN; match class: 1";20012;5739;"Brain_-_Cortex_female_7_community"
"26";"query_1";TRUE;2,27108846264752e-16;563;80;25;0,3125;0,044404973357016;"TF:M12616_1";"TF";"Factor: HMGXB3; motif: NRGCCAATSRGNRNNS; match class: 1";20012;3475;"Brain_-_Cortex_female_7_community"
"27";"query_1";TRUE;3,44657919523259e-14;10341;80;76;0,95;0,00734938593946427;"TF:M03805";"TF";"Factor: YB-1; motif: CCAMTCNGMR";20012;9008;"Brain_-_Cortex_female_7_community"
"28";"query_1";TRUE;4,07920175504128e-14;1039;80;29;0,3625;0,0279114533205005;"TF:M02107";"TF";"Factor: NF-YC; motif: NRGCCAATYAGMGC";20012;5752;"Brain_-_Cortex_female_7_community"
"29";"query_1";TRUE;9,69557040402593e-14;12485;80;80;1;0,00640768922707249;"TF:M12668";"TF";"Factor: SP2; motif: NNRRCCAATSRGNRNSNGSN";20012;7876;"Brain_-_Cortex_female_7_community"
"30";"query_1";TRUE;4,11525009763325e-13;3850;80;49;0,6125;0,0127272727272727;"TF:M00209";"TF";"Factor: NF-Y; motif: NCTGATTGGYTASY";20012;5756;"Brain_-_Cortex_female_7_community"
"31";"query_1";TRUE;5,55886543745508e-12;411;80;19;0,2375;0,0462287104622871;"TF:M10006_1";"TF";"Factor: NF-YC; motif: NNRRCCAATCAGNR; match class: 1";20012;5749;"Brain_-_Cortex_female_7_community"
"32";"query_1";TRUE;6,99052944004944e-12;3766;80;47;0,5875;0,0124800849707913;"TF:M03805_1";"TF";"Factor: YB-1; motif: CCAMTCNGMR; match class: 1";20012;9009;"Brain_-_Cortex_female_7_community"
"33";"query_1";TRUE;5,89785232676896e-11;2380;80;37;0,4625;0,015546218487395;"TF:M00687";"TF";"Factor: alpha-CP1; motif: CAGCCAATGAG";20012;30;"Brain_-_Cortex_female_7_community"
"34";"query_1";TRUE;9,05499401505456e-11;293;80;16;0,2;0,0546075085324232;"TF:M12643_1";"TF";"Factor: NFYB; motif: RGCCAATSRGNRNNNNSNG; match class: 1";20012;5747;"Brain_-_Cortex_female_7_community"
"35";"query_1";TRUE;7,08234596750942e-10;225;80;14;0,175;0,0622222222222222;"TF:M02106_1";"TF";"Factor: NF-YA; motif: CRGCCAATCAGNRN; match class: 1";20012;5741;"Brain_-_Cortex_female_7_community"
"36";"query_1";TRUE;7,00801074277059e-08;202;80;12;0,15;0,0594059405940594;"TF:M04683_1";"TF";"Factor: NF-YA; motif: YTCTSATTGGYYRN; match class: 1";20012;5731;"Brain_-_Cortex_female_7_community"
"37";"query_1";TRUE;7,31649371779543e-08;702;80;19;0,2375;0,0270655270655271;"TF:M00209_1";"TF";"Factor: NF-Y; motif: NCTGATTGGYTASY; match class: 1";20012;5757;"Brain_-_Cortex_female_7_community"
"38";"query_1";TRUE;5,88509155623785e-07;188;80;11;0,1375;0,0585106382978723;"TF:M00287_1";"TF";"Factor: NF-Y; motif: NNNRRCCAATSRGNNN; match class: 1";20012;5755;"Brain_-_Cortex_female_7_community"
"39";"query_1";TRUE;7,56668795508155e-07;248;80;12;0,15;0,0483870967741935;"TF:M00687_1";"TF";"Factor: alpha-CP1; motif: CAGCCAATGAG; match class: 1";20012;31;"Brain_-_Cortex_female_7_community"
"40";"query_1";TRUE;9,18685010431724e-07;196;80;11;0,1375;0,0561224489795918;"TF:M07302_1";"TF";"Factor: NF-Y; motif: RGCCAATCRGN; match class: 1";20012;5759;"Brain_-_Cortex_female_7_community"
"41";"query_1";TRUE;1,49905034975407e-06;647;80;17;0,2125;0,0262751159196291;"TF:M07222";"TF";"Factor: NFYA; motif: AGNSYKCTGATTGGTNNR";20012;5732;"Brain_-_Cortex_female_7_community"
"42";"query_1";TRUE;4,6846986502655e-06;291;80;12;0,15;0,0412371134020619;"TF:M09816_1";"TF";"Factor: NFYA; motif: RRCCAATCAGN; match class: 1";20012;5735;"Brain_-_Cortex_female_7_community"
"43";"query_1";TRUE;6,36389433780836e-06;299;80;12;0,15;0,040133779264214;"TF:M10005_1";"TF";"Factor: NF-YA; motif: NYRRCCAATCAGAR; match class: 1";20012;5737;"Brain_-_Cortex_female_7_community"
"44";"query_1";TRUE;1,1646220892254e-05;139;80;9;0,1125;0,0647482014388489;"TF:M00775_1";"TF";"Factor: NF-Y; motif: NNNNRRCCAATSR; match class: 1";20012;5763;"Brain_-_Cortex_female_7_community"
"45";"query_1";TRUE;2,06085674076593e-05;9196;80;62;0,775;0,00674206176598521;"TF:M07476";"TF";"Factor: Lhx8; motif: TGATTG";20012;4732;"Brain_-_Cortex_female_7_community"
"46";"query_1";TRUE;0,00210678850948617;128;80;7;0,0875;0,0546875;"TF:M12455_1";"TF";"Factor: NFYC; motif: NNCCAATCANN; match class: 1";20012;5751;"Brain_-_Cortex_female_7_community"
"47";"query_1";TRUE;0,00358004429295483;6306;80;46;0,575;0,00729464002537266;"TF:M07300";"TF";"Factor: NF-1C; motif: TTGGCNN";20012;5562;"Brain_-_Cortex_female_7_community"
"48";"query_1";TRUE;0,00467906782658992;549;80;12;0,15;0,0218579234972678;"TF:M07115";"TF";"Factor: NF-YB; motif: NNNYNRRCCAATCAG";20012;5742;"Brain_-_Cortex_female_7_community"
"49";"query_1";TRUE;0,0149849914552877;3142;80;29;0,3625;0,00922978994271165;"TF:M07476_1";"TF";"Factor: Lhx8; motif: TGATTG; match class: 1";20012;4733;"Brain_-_Cortex_female_7_community"
"50";"query_1";TRUE;0,0195414908303234;5137;80;39;0,4875;0,00759197975472065;"TF:M01967";"TF";"Factor: Pbx; motif: NKTGATTGACRKSN";20012;6462;"Brain_-_Cortex_female_7_community"
